<?xml version='1.0' encoding="utf-8"?>
<!DOCTYPE quiz SYSTEM "quiz.dtd">

<quiz versao="01">
    <disciplina>POS</disciplina>
    <professor>
        <nome>Cirilo</nome>
        <matricula>23243</matricula>
    </professor>
    <turma>Info web 4v</turma>

    <data>17/07/2024</data>

    <questoes>
        <questao>
            <enunciado>marque a alternativa correta sobre o git</enunciado>
            <pontuacao>5</pontuacao>
            <alternativas>
                <alternativa correta="nao"></alternativa>
                <alternativa correta="nao"></alternativa>
                <alternativa correta="nao"></alternativa>
                <alternativa correta="sim"></alternativa>
            </alternativas>
        </questao>

        <questao>
            <enunciado>explique diferen√ßas entre git e github</enunciado>
            <pontuacao>5</pontuacao>
            <alternativas>
                <alternativa correta="nao"></alternativa>
                <alternativa correta="sim"></alternativa>
                <alternativa correta="nao"></alternativa>
                <alternativa correta="nao"></alternativa>
            </alternativas>
        </questao>

        <questao>
            <enunciado>verdadeiro ou falso sobre xml</enunciado>
            <pontuacao>5</pontuacao>
            <alternativas>
                <alternativa correta="nao"></alternativa>
                <alternativa correta="sim"></alternativa>
                <alternativa correta="sim"></alternativa>
                <alternativa correta="nao"></alternativa>
            </alternativas>
        </questao>

        <questao>
            <enunciado>quais desses comandos em git esta correto?</enunciado>
            <pontuacao>5</pontuacao>
            <alternativas>
                <alternativa correta="nao"></alternativa>
                <alternativa correta="sim"></alternativa>
                <alternativa correta="nao"></alternativa>
                <alternativa correta="nao"></alternativa>
            </alternativas>
        </questao>

        <questao>
            <enunciado>marque a alternativa incorreta sobre os problemas que o gir resolve</enunciado>
            <pontuacao>5</pontuacao>
            <alternativas>
                <alternativa correta="nao"></alternativa>
                <alternativa correta="nao"></alternativa>
                <alternativa correta="sim"></alternativa>
                <alternativa correta="nao"></alternativa>
            </alternativas>
        </questao>
    </questoes>
</quiz>